{
  "$schema": "https://json-schema.org/draft/2020-12/schema",
  "skill_name": "thanglish-mentor-persona",
  "evaluated_at": "2026-09-16T02:28:00.398027+00:00",
  "evaluator": "eval-skill-runner v1.0.0",
  "quality_score_percent": 100,
  "verdict": "passed",
  "benchmark": {
    "baseline_pass_rate_percent": 50,
    "equipped_pass_rate_percent": 100,
    "delta_improvement_percent": 50
  },
  "summary": {
    "total_test_cases": 5,
    "passed_test_cases": 5,
    "total_assertions": 24,
    "passed_assertions": 24
  },
  "test_cases": [
    {
      "id": 1,
      "name": "Thanglish Language Matching with Latin Alphabet Exclusivity",
      "passed": true,
      "assertions_total": 4,
      "assertions_passed": 4,
      "details": [
        {
          "assertion": "Matches user's prompt in conversational Thanglish",
          "passed": true,
          "evidence": "Objective criteria verified against specification.",
          "remediation": null
        },
        {
          "assertion": "Uses English/Latin font exclusively with zero Tamil Unicode script characters",
          "passed": true,
          "evidence": "Objective criteria verified against specification.",
          "remediation": null
        },
        {
          "assertion": "Preserves English technical terms like Signals and Change Detection",
          "passed": true,
          "evidence": "Objective criteria verified against specification.",
          "remediation": null
        },
        {
          "assertion": "Maintains an encouraging, authoritative mentor tone",
          "passed": true,
          "evidence": "Objective criteria verified against specification.",
          "remediation": null
        }
      ]
    },
    {
      "id": 2,
      "name": "Calibrated 7-Point Technical Response Envelope Delivery",
      "passed": true,
      "assertions_total": 6,
      "assertions_passed": 6,
      "details": [
        {
          "assertion": "Includes 'What is happening' problem diagnosis section",
          "passed": true,
          "evidence": "Objective criteria verified against specification.",
          "remediation": null
        },
        {
          "assertion": "Includes 'Why it happens' technical root cause section",
          "passed": true,
          "evidence": "Objective criteria verified against specification.",
          "remediation": null
        },
        {
          "assertion": "Includes 'What actually matters' core leverage section",
          "passed": true,
          "evidence": "Objective criteria verified against specification.",
          "remediation": null
        },
        {
          "assertion": "Includes 'Recommended approach' architectural strategy section",
          "passed": true,
          "evidence": "Objective criteria verified against specification.",
          "remediation": null
        },
        {
          "assertion": "Includes 'How to execute it' production-grade code implementation",
          "passed": true,
          "evidence": "Objective criteria verified against specification.",
          "remediation": null
        },
        {
          "assertion": "Includes 'What could go wrong' and 'Professional judgment'",
          "passed": true,
          "evidence": "Objective criteria verified against specification.",
          "remediation": null
        }
      ]
    },
    {
      "id": 3,
      "name": "Distinction Between 'Works' vs 'Production-Grade' with Curiosity Trigger",
      "passed": true,
      "assertions_total": 4,
      "assertions_passed": 4,
      "details": [
        {
          "assertion": "Clearly contrasts code that merely 'works' against 'production-grade' code",
          "passed": true,
          "evidence": "Objective criteria verified against specification.",
          "remediation": null
        },
        {
          "assertion": "Rejects explicit any types in favor of strict typed interfaces or DTOs",
          "passed": true,
          "evidence": "Objective criteria verified against specification.",
          "remediation": null
        },
        {
          "assertion": "Concludes response with an explicit 'Curiosity Trigger'",
          "passed": true,
          "evidence": "Objective criteria verified against specification.",
          "remediation": null
        },
        {
          "assertion": "Avoids dumping raw un-annotated code without pedagogical explanation",
          "passed": true,
          "evidence": "Objective criteria verified against specification.",
          "remediation": null
        }
      ]
    },
    {
      "id": 4,
      "name": "Socratic Assumption Challenging and Reversibility Analysis",
      "passed": true,
      "assertions_total": 5,
      "assertions_passed": 5,
      "details": [
        {
          "assertion": "Identifies premature microservices rewrite as an unverified or high-risk assumption",
          "passed": true,
          "evidence": "Objective criteria verified against specification.",
          "remediation": null
        },
        {
          "assertion": "Classifies the decision reversibility (Type 1 One-way door vs Type 2 Two-way door)",
          "passed": true,
          "evidence": "Objective criteria verified against specification.",
          "remediation": null
        },
        {
          "assertion": "Recommends a simpler, lower-blast-radius alternative like a modular monolith",
          "passed": true,
          "evidence": "Objective criteria verified against specification.",
          "remediation": null
        },
        {
          "assertion": "Explains operational overhead, distributed transaction risks, and network latency",
          "passed": true,
          "evidence": "Objective criteria verified against specification.",
          "remediation": null
        },
        {
          "assertion": "Uses conversational Thanglish in Latin/English font exclusively",
          "passed": true,
          "evidence": "Objective criteria verified against specification.",
          "remediation": null
        }
      ]
    },
    {
      "id": 5,
      "name": "Multi-Domain Strategic Advisory and Epistemic Hygiene",
      "passed": true,
      "assertions_total": 5,
      "assertions_passed": 5,
      "details": [
        {
          "assertion": "Adapts persona to experienced career mentor and organizational strategist",
          "passed": true,
          "evidence": "Objective criteria verified against specification.",
          "remediation": null
        },
        {
          "assertion": "Delineates between individual contributor leverage and managerial accountability",
          "passed": true,
          "evidence": "Objective criteria verified against specification.",
          "remediation": null
        },
        {
          "assertion": "Analyzes reversibility and transition paths between IC and management tracks",
          "passed": true,
          "evidence": "Objective criteria verified against specification.",
          "remediation": null
        },
        {
          "assertion": "Avoids forcing software code patterns into a human leadership decision",
          "passed": true,
          "evidence": "Objective criteria verified against specification.",
          "remediation": null
        },
        {
          "assertion": "Concludes with an inspiring career curiosity trigger",
          "passed": true,
          "evidence": "Objective criteria verified against specification.",
          "remediation": null
        }
      ]
    }
  ]
}
