{
  "$schema": "https://json-schema.org/draft/2020-12/schema",
  "skill_name": "database-foundation",
  "evaluated_at": "2026-09-10T03:16:54.244972+00:00",
  "evaluator": "eval-skill-runner v1.0.0",
  "quality_score_percent": 100,
  "verdict": "passed",
  "benchmark": {
    "baseline_pass_rate_percent": 50,
    "equipped_pass_rate_percent": 100,
    "delta_improvement_percent": 50
  },
  "summary": {
    "total_test_cases": 3,
    "passed_test_cases": 3,
    "total_assertions": 12,
    "passed_assertions": 12
  },
  "test_cases": [
    {
      "id": 1,
      "name": "Production Connection Pool Sizing & Timeout Defense",
      "passed": true,
      "assertions_total": 4,
      "assertions_passed": 4,
      "details": [
        {
          "assertion": "Configures pool.min (>= 2) to maintain warm connections and eliminate handshake latency",
          "passed": true,
          "evidence": "Objective criteria verified against specification.",
          "remediation": null
        },
        {
          "assertion": "Configures pool.max (e.g. 10) to prevent database thread exhaustion and connection starvation",
          "passed": true,
          "evidence": "Objective criteria verified against specification.",
          "remediation": null
        },
        {
          "assertion": "Enforces acquireTimeout (30s) to fail fast when pool is exhausted instead of hanging requests",
          "passed": true,
          "evidence": "Objective criteria verified against specification.",
          "remediation": null
        },
        {
          "assertion": "Enforces statement or queryTimeout (30s) to terminate runaway unindexed queries",
          "passed": true,
          "evidence": "Objective criteria verified against specification.",
          "remediation": null
        }
      ]
    },
    {
      "id": 2,
      "name": "Versioned Idempotent SQL Migrations & Audit Columns",
      "passed": true,
      "assertions_total": 4,
      "assertions_passed": 4,
      "details": [
        {
          "assertion": "Provides both forward (up) and rollback (down) SQL migration blocks",
          "passed": true,
          "evidence": "Objective criteria verified against specification.",
          "remediation": null
        },
        {
          "assertion": "Includes idempotent guards (IF NOT EXISTS, IF EXISTS) across table and index statements",
          "passed": true,
          "evidence": "Objective criteria verified against specification.",
          "remediation": null
        },
        {
          "assertion": "Includes mandatory audit columns: created_at, updated_at, and nullable deleted_at for soft deletes",
          "passed": true,
          "evidence": "Objective criteria verified against specification.",
          "remediation": null
        },
        {
          "assertion": "Strictly avoids automatic schema synchronization (synchronize: true) in production",
          "passed": true,
          "evidence": "Objective criteria verified against specification.",
          "remediation": null
        }
      ]
    },
    {
      "id": 3,
      "name": "Foreign Key Indexing & Slow Query Telemetry",
      "passed": true,
      "assertions_total": 4,
      "assertions_passed": 4,
      "details": [
        {
          "assertion": "Creates explicit index for foreign key columns to prevent table locks and full-table scans",
          "passed": true,
          "evidence": "Objective criteria verified against specification.",
          "remediation": null
        },
        {
          "assertion": "Applies partial index filter (WHERE deleted_at IS NULL) to optimize index footprint",
          "passed": true,
          "evidence": "Objective criteria verified against specification.",
          "remediation": null
        },
        {
          "assertion": "Logs database queries taking longer than 200ms as structured WARN events",
          "passed": true,
          "evidence": "Objective criteria verified against specification.",
          "remediation": null
        },
        {
          "assertion": "Sanitizes query strings to ensure credentials or PII parameters are not logged",
          "passed": true,
          "evidence": "Objective criteria verified against specification.",
          "remediation": null
        }
      ]
    }
  ]
}
