{
  "$schema": "https://json-schema.org/draft/2020-12/schema",
  "skill_name": "api-documentation-and-contracts",
  "evaluated_at": "2026-09-10T03:46:28.628963+00:00",
  "evaluator": "eval-skill-runner v1.0.0",
  "quality_score_percent": 100,
  "verdict": "passed",
  "benchmark": {
    "baseline_pass_rate_percent": 50,
    "equipped_pass_rate_percent": 100,
    "delta_improvement_percent": 50
  },
  "summary": {
    "total_test_cases": 3,
    "passed_test_cases": 3,
    "total_assertions": 12,
    "passed_assertions": 12
  },
  "test_cases": [
    {
      "id": 1,
      "name": "Comprehensive OpenAPI 3.x Endpoint & Error Modeling",
      "passed": true,
      "assertions_total": 4,
      "assertions_passed": 4,
      "details": [
        {
          "assertion": "Defines explicit OpenAPI schema for request body with realistic examples",
          "passed": true,
          "evidence": "Objective criteria verified against specification.",
          "remediation": null
        },
        {
          "assertion": "Documents HTTP 201 Created success response with typed response DTO",
          "passed": true,
          "evidence": "Objective criteria verified against specification.",
          "remediation": null
        },
        {
          "assertion": "Documents HTTP 400 validation error response matching standard error envelope",
          "passed": true,
          "evidence": "Objective criteria verified against specification.",
          "remediation": null
        },
        {
          "assertion": "Documents HTTP 409 conflict error response for duplicate account natural keys",
          "passed": true,
          "evidence": "Objective criteria verified against specification.",
          "remediation": null
        }
      ]
    },
    {
      "id": 2,
      "name": "Production Interactive Documentation Route Hardening",
      "passed": true,
      "assertions_total": 4,
      "assertions_passed": 4,
      "details": [
        {
          "assertion": "Inspects NODE_ENV or environment configuration before mounting documentation routes",
          "passed": true,
          "evidence": "Objective criteria verified against specification.",
          "remediation": null
        },
        {
          "assertion": "Disables public Swagger UI interactive sandbox in production environments",
          "passed": true,
          "evidence": "Objective criteria verified against specification.",
          "remediation": null
        },
        {
          "assertion": "Protects internal API route shapes and validation rules from unauthorized reconnaissance",
          "passed": true,
          "evidence": "Objective criteria verified against specification.",
          "remediation": null
        },
        {
          "assertion": "Configures BearerAuth security scheme for authenticated sandbox execution in non-prod",
          "passed": true,
          "evidence": "Objective criteria verified against specification.",
          "remediation": null
        }
      ]
    },
    {
      "id": 3,
      "name": "Consumer-Driven Contract Testing (Pact) Governance",
      "passed": true,
      "assertions_total": 4,
      "assertions_passed": 4,
      "details": [
        {
          "assertion": "Defines consumer contract interactions with expected request and response shapes",
          "passed": true,
          "evidence": "Objective criteria verified against specification.",
          "remediation": null
        },
        {
          "assertion": "Executes provider pact verification against actual backend controller handlers",
          "passed": true,
          "evidence": "Objective criteria verified against specification.",
          "remediation": null
        },
        {
          "assertion": "Enforces pre-deployment verification check (e.g. can-i-deploy) to block breaking changes",
          "passed": true,
          "evidence": "Objective criteria verified against specification.",
          "remediation": null
        },
        {
          "assertion": "Prevents silent contract drift between frontend clients and backend APIs",
          "passed": true,
          "evidence": "Objective criteria verified against specification.",
          "remediation": null
        }
      ]
    }
  ]
}
