{
  "$schema": "https://json-schema.org/draft/2020-12/schema",
  "skill_name": "application-bootstrap",
  "evaluated_at": "2026-09-10T02:49:03.382392+00:00",
  "evaluator": "eval-skill-runner v1.0.0",
  "quality_score_percent": 100,
  "verdict": "passed",
  "benchmark": {
    "baseline_pass_rate_percent": 50,
    "equipped_pass_rate_percent": 100,
    "delta_improvement_percent": 50
  },
  "summary": {
    "total_test_cases": 3,
    "passed_test_cases": 3,
    "total_assertions": 12,
    "passed_assertions": 12
  },
  "test_cases": [
    {
      "id": 1,
      "name": "Deterministic 13-Step Boot Sequencing & Infrastructure Gate",
      "passed": true,
      "assertions_total": 4,
      "assertions_passed": 4,
      "details": [
        {
          "assertion": "Executes startup sequence in strict chronological order from config validation to server listen",
          "passed": true,
          "evidence": "Objective criteria verified against specification.",
          "remediation": null
        },
        {
          "assertion": "Ensures database connection is verified healthy before server.listen() is invoked",
          "passed": true,
          "evidence": "Objective criteria verified against specification.",
          "remediation": null
        },
        {
          "assertion": "Binds OS termination signals (SIGTERM/SIGINT) prior to opening the network port",
          "passed": true,
          "evidence": "Objective criteria verified against specification.",
          "remediation": null
        },
        {
          "assertion": "Restricts main entry point exclusively to technical wiring with zero business logic",
          "passed": true,
          "evidence": "Objective criteria verified against specification.",
          "remediation": null
        }
      ]
    },
    {
      "id": 2,
      "name": "Process-Level Crash Handlers & Structured Fatal Logging",
      "passed": true,
      "assertions_total": 4,
      "assertions_passed": 4,
      "details": [
        {
          "assertion": "Registers explicit 'unhandledRejection' process listener",
          "passed": true,
          "evidence": "Objective criteria verified against specification.",
          "remediation": null
        },
        {
          "assertion": "Registers explicit 'uncaughtException' process listener",
          "passed": true,
          "evidence": "Objective criteria verified against specification.",
          "remediation": null
        },
        {
          "assertion": "Emits structured FATAL level log including complete error stack and context",
          "passed": true,
          "evidence": "Objective criteria verified against specification.",
          "remediation": null
        },
        {
          "assertion": "Terminates process with non-zero exit code (1) to prevent degraded zombie state",
          "passed": true,
          "evidence": "Objective criteria verified against specification.",
          "remediation": null
        }
      ]
    },
    {
      "id": 3,
      "name": "Resilient Database Connection with Exponential Backoff Retries",
      "passed": true,
      "assertions_total": 4,
      "assertions_passed": 4,
      "details": [
        {
          "assertion": "Implements minimum 3 retry attempts for transient startup connection failures",
          "passed": true,
          "evidence": "Objective criteria verified against specification.",
          "remediation": null
        },
        {
          "assertion": "Calculates delay using exponential backoff to avoid thundering herd problem",
          "passed": true,
          "evidence": "Objective criteria verified against specification.",
          "remediation": null
        },
        {
          "assertion": "Executes a health check ping query (e.g. 'SELECT 1') to verify connection health",
          "passed": true,
          "evidence": "Objective criteria verified against specification.",
          "remediation": null
        },
        {
          "assertion": "Logs fatal diagnostic error and exits cleanly if all retry attempts fail",
          "passed": true,
          "evidence": "Objective criteria verified against specification.",
          "remediation": null
        }
      ]
    }
  ]
}
