{
  "$schema": "https://json-schema.org/draft/2020-12/schema",
  "skill_name": "google-suite-seo-and-sitemaps",
  "evaluated_at": "2026-09-06T17:15:09.676561+00:00",
  "evaluator": "eval-skill-runner v1.0.0",
  "quality_score_percent": 100,
  "verdict": "passed",
  "benchmark": {
    "baseline_pass_rate_percent": 50,
    "equipped_pass_rate_percent": 100,
    "delta_improvement_percent": 50
  },
  "summary": {
    "total_test_cases": 3,
    "passed_test_cases": 3,
    "total_assertions": 12,
    "passed_assertions": 12
  },
  "test_cases": [
    {
      "id": 1,
      "name": "Canonical Link Tag & URL Normalization",
      "passed": true,
      "assertions_total": 4,
      "assertions_passed": 4,
      "details": [
        {
          "assertion": "Renders explicit <link rel='canonical' href='...'> in document head",
          "passed": true,
          "evidence": "Objective criteria verified against specification.",
          "remediation": null
        },
        {
          "assertion": "Enforces single apex domain vs www hostname consistency",
          "passed": true,
          "evidence": "Objective criteria verified against specification.",
          "remediation": null
        },
        {
          "assertion": "Configures self-referencing canonical URL on subdomains",
          "passed": true,
          "evidence": "Objective criteria verified against specification.",
          "remediation": null
        },
        {
          "assertion": "Strips dynamic UTM and tracking query parameters from canonical URL",
          "passed": true,
          "evidence": "Objective criteria verified against specification.",
          "remediation": null
        }
      ]
    },
    {
      "id": 2,
      "name": "XML Sitemap & Robots.txt Directives",
      "passed": true,
      "assertions_total": 4,
      "assertions_passed": 4,
      "details": [
        {
          "assertion": "Defines valid XML sitemap structure conforming to sitemaps.org schema",
          "passed": true,
          "evidence": "Objective criteria verified against specification.",
          "remediation": null
        },
        {
          "assertion": "Assigns priority tiers (1.0 for home, 0.8 for tools, 0.3 for legal)",
          "passed": true,
          "evidence": "Objective criteria verified against specification.",
          "remediation": null
        },
        {
          "assertion": "Configures robots.txt referencing absolute sitemap URL",
          "passed": true,
          "evidence": "Objective criteria verified against specification.",
          "remediation": null
        },
        {
          "assertion": "Disallows crawler indexing of private administrative and API routes",
          "passed": true,
          "evidence": "Objective criteria verified against specification.",
          "remediation": null
        }
      ]
    },
    {
      "id": 3,
      "name": "JSON-LD WebApplication Schema Rich Snippet",
      "passed": true,
      "assertions_total": 4,
      "assertions_passed": 4,
      "details": [
        {
          "assertion": "Embeds script type='application/ld+json' in document head",
          "passed": true,
          "evidence": "Objective criteria verified against specification.",
          "remediation": null
        },
        {
          "assertion": "Declares Schema.org context and WebApplication or SoftwareApplication type",
          "passed": true,
          "evidence": "Objective criteria verified against specification.",
          "remediation": null
        },
        {
          "assertion": "Provides application name, url, description, and operatingSystem properties",
          "passed": true,
          "evidence": "Objective criteria verified against specification.",
          "remediation": null
        },
        {
          "assertion": "Includes author or creator entity metadata",
          "passed": true,
          "evidence": "Objective criteria verified against specification.",
          "remediation": null
        }
      ]
    }
  ]
}
