{
  "$schema": "https://json-schema.org/draft/2020-12/schema",
  "skill_name": "clean-architecture",
  "evaluated_at": "2026-09-09T17:36:39.024784+00:00",
  "evaluator": "eval-skill-runner v1.0.0",
  "quality_score_percent": 100,
  "verdict": "passed",
  "benchmark": {
    "baseline_pass_rate_percent": 50,
    "equipped_pass_rate_percent": 100,
    "delta_improvement_percent": 50
  },
  "summary": {
    "total_test_cases": 3,
    "passed_test_cases": 3,
    "total_assertions": 12,
    "passed_assertions": 12
  },
  "test_cases": [
    {
      "id": 1,
      "name": "Domain-First Feature Modularization & Layout Audit",
      "passed": true,
      "assertions_total": 4,
      "assertions_passed": 4,
      "details": [
        {
          "assertion": "Rejects top-level technical directories ('controllers/', 'services/', 'repositories/')",
          "passed": true,
          "evidence": "Objective criteria verified against specification.",
          "remediation": null
        },
        {
          "assertion": "Packages code into vertical domain modules under 'src/modules/<feature>/'",
          "passed": true,
          "evidence": "Objective criteria verified against specification.",
          "remediation": null
        },
        {
          "assertion": "Ensures unit tests are co-located alongside target services",
          "passed": true,
          "evidence": "Objective criteria verified against specification.",
          "remediation": null
        },
        {
          "assertion": "Restricts 'src/common/' strictly to stateless cross-cutting primitives",
          "passed": true,
          "evidence": "Objective criteria verified against specification.",
          "remediation": null
        }
      ]
    },
    {
      "id": 2,
      "name": "Pure Domain Entity Decoupling from Persistence ORM",
      "passed": true,
      "assertions_total": 4,
      "assertions_passed": 4,
      "details": [
        {
          "assertion": "Removes all ORM decorators and database imports from core domain entities",
          "passed": true,
          "evidence": "Objective criteria verified against specification.",
          "remediation": null
        },
        {
          "assertion": "Keeps domain entities as pure language classes with zero external dependencies",
          "passed": true,
          "evidence": "Objective criteria verified against specification.",
          "remediation": null
        },
        {
          "assertion": "Encapsulates business rules and state mutations directly within the domain entity",
          "passed": true,
          "evidence": "Objective criteria verified against specification.",
          "remediation": null
        },
        {
          "assertion": "Implements a Data Mapper in infrastructure to convert between persistence and domain models",
          "passed": true,
          "evidence": "Objective criteria verified against specification.",
          "remediation": null
        }
      ]
    },
    {
      "id": 3,
      "name": "Dependency Inversion with Ports and Adapters",
      "passed": true,
      "assertions_total": 4,
      "assertions_passed": 4,
      "details": [
        {
          "assertion": "Defines repository port interface inside the domain or application layer",
          "passed": true,
          "evidence": "Objective criteria verified against specification.",
          "remediation": null
        },
        {
          "assertion": "Ensures application use case accepts the interface abstraction via constructor dependency injection",
          "passed": true,
          "evidence": "Objective criteria verified against specification.",
          "remediation": null
        },
        {
          "assertion": "Implements concrete database queries exclusively inside the infrastructure adapter",
          "passed": true,
          "evidence": "Objective criteria verified against specification.",
          "remediation": null
        },
        {
          "assertion": "Enforces inward dependency flow: Adapter -> Use Case -> Domain <- Infrastructure",
          "passed": true,
          "evidence": "Objective criteria verified against specification.",
          "remediation": null
        }
      ]
    }
  ]
}
