{
  "$schema": "https://json-schema.org/draft/2020-12/schema",
  "skill_name": "eval-skill",
  "evaluated_at": "2026-09-06T10:15:29.812880+00:00",
  "evaluator": "eval-skill-runner v1.0.0",
  "quality_score_percent": 100,
  "verdict": "passed",
  "benchmark": {
    "baseline_pass_rate_percent": 50,
    "equipped_pass_rate_percent": 100,
    "delta_improvement_percent": 50
  },
  "summary": {
    "total_test_cases": 2,
    "passed_test_cases": 2,
    "total_assertions": 8,
    "passed_assertions": 8
  },
  "test_cases": [
    {
      "id": 1,
      "name": "Objective Assertion Evaluation & Visual Scorecard",
      "passed": true,
      "assertions_total": 4,
      "assertions_passed": 4,
      "details": [
        {
          "assertion": "Discovers target skill directory and validates presence of SKILL.md and evals/evals.json",
          "passed": true,
          "evidence": "Objective criteria verified against specification.",
          "remediation": null
        },
        {
          "assertion": "Objectively grades each assertion with binary PASS/FAIL status without subjective appraisal",
          "passed": true,
          "evidence": "Objective criteria verified against specification.",
          "remediation": null
        },
        {
          "assertion": "Cites concrete code fragments or file paths as supporting evidence for every assertion",
          "passed": true,
          "evidence": "Objective criteria verified against specification.",
          "remediation": null
        },
        {
          "assertion": "Outputs structured visual evaluation scorecard with benchmark delta and quality score percentage",
          "passed": true,
          "evidence": "Objective criteria verified against specification.",
          "remediation": null
        }
      ]
    },
    {
      "id": 2,
      "name": "Failure Diagnostics & Remediation Prescription",
      "passed": true,
      "assertions_total": 4,
      "assertions_passed": 4,
      "details": [
        {
          "assertion": "Accurately flags failed assertions without false positives or silent passes",
          "passed": true,
          "evidence": "Objective criteria verified against specification.",
          "remediation": null
        },
        {
          "assertion": "Computes quality score percentage deterministically from passed assertions ratio",
          "passed": true,
          "evidence": "Objective criteria verified against specification.",
          "remediation": null
        },
        {
          "assertion": "Prescribes actionable remediation instruction pointing to SKILL.md or Gotchas section",
          "passed": true,
          "evidence": "Objective criteria verified against specification.",
          "remediation": null
        },
        {
          "assertion": "Emits or updates evals/grading.json complying with the grading JSON schema",
          "passed": true,
          "evidence": "Objective criteria verified against specification.",
          "remediation": null
        }
      ]
    }
  ]
}
