{
  "$schema": "https://json-schema.org/draft/2020-12/schema",
  "skill_name": "angular-enterprise-forms",
  "evaluated_at": "2026-09-06T11:06:19.428580+00:00",
  "evaluator": "eval-skill-runner v1.0.0",
  "quality_score_percent": 100,
  "verdict": "passed",
  "benchmark": {
    "baseline_pass_rate_percent": 50,
    "equipped_pass_rate_percent": 100,
    "delta_improvement_percent": 50
  },
  "summary": {
    "total_test_cases": 3,
    "passed_test_cases": 3,
    "total_assertions": 14,
    "passed_assertions": 14
  },
  "test_cases": [
    {
      "id": 1,
      "name": "Test Case #1",
      "passed": true,
      "assertions_total": 5,
      "assertions_passed": 5,
      "details": [
        {
          "assertion": "Uses inject(FormBuilder).nonNullable or NonNullableFormBuilder",
          "passed": true,
          "evidence": "Objective criteria verified against specification.",
          "remediation": null
        },
        {
          "assertion": "Declares dedicated TypeScript interface for form model (zero 'any')",
          "passed": true,
          "evidence": "Objective criteria verified against specification.",
          "remediation": null
        },
        {
          "assertion": "Uses centralized error presenter component rather than inline template checks",
          "passed": true,
          "evidence": "Objective criteria verified against specification.",
          "remediation": null
        },
        {
          "assertion": "Executes markAllAsTouched() on submit before validity check",
          "passed": true,
          "evidence": "Objective criteria verified against specification.",
          "remediation": null
        },
        {
          "assertion": "Uses getRawValue() for backend payload extraction",
          "passed": true,
          "evidence": "Objective criteria verified against specification.",
          "remediation": null
        }
      ]
    },
    {
      "id": 2,
      "name": "Test Case #2",
      "passed": true,
      "assertions_total": 5,
      "assertions_passed": 5,
      "details": [
        {
          "assertion": "Implements ControlValueAccessor interface",
          "passed": true,
          "evidence": "Objective criteria verified against specification.",
          "remediation": null
        },
        {
          "assertion": "Provides NG_VALUE_ACCESSOR using forwardRef",
          "passed": true,
          "evidence": "Objective criteria verified against specification.",
          "remediation": null
        },
        {
          "assertion": "Configures ChangeDetectionStrategy.OnPush",
          "passed": true,
          "evidence": "Objective criteria verified against specification.",
          "remediation": null
        },
        {
          "assertion": "Properly propagates value changes via registered onChange callback",
          "passed": true,
          "evidence": "Objective criteria verified against specification.",
          "remediation": null
        },
        {
          "assertion": "Safely handles null and undefined in writeValue",
          "passed": true,
          "evidence": "Objective criteria verified against specification.",
          "remediation": null
        }
      ]
    },
    {
      "id": 3,
      "name": "Test Case #3",
      "passed": true,
      "assertions_total": 4,
      "assertions_passed": 4,
      "details": [
        {
          "assertion": "References scripts/audit_angular_forms.py CLI tool",
          "passed": true,
          "evidence": "Objective criteria verified against specification.",
          "remediation": null
        },
        {
          "assertion": "Detects untyped form declarations and legacy UntypedFormGroup",
          "passed": true,
          "evidence": "Objective criteria verified against specification.",
          "remediation": null
        },
        {
          "assertion": "Detects unmanaged form stream subscriptions lacking takeUntilDestroyed",
          "passed": true,
          "evidence": "Objective criteria verified against specification.",
          "remediation": null
        },
        {
          "assertion": "Outputs structured summary of violations with line numbers",
          "passed": true,
          "evidence": "Objective criteria verified against specification.",
          "remediation": null
        }
      ]
    }
  ]
}
